{
  "schema_version": "1.0",
  "artifact_id": "018f6c70-1ebb-7d05-4f5a-8b6c7d8e9f12",
  "project_id": "018f6b2e-a3d1-7c01-9e2a-5f8d3a1b7c02",
  "kind": "vault-export",
  "run_id": "018f6b40-5c88-7208-6f9a-2a5e0d8c4e75",
  "path": "vault/superconducting-qubits",
  "format": "markdown",
  "created_at": "2026-01-15T10:00:00Z"
}
